<?xml version="1.0" encoding="UTF-8"?>
<urlset xmlns="http://www.sitemaps.org/schemas/sitemap/0.9">
  <!-- Páginas Principais -->
  <url>
    <loc>https://focconavida.com.br/</loc>
    <lastmod>2025-12-16</lastmod>
    <changefreq>weekly</changefreq>
    <priority>1.0</priority>
  </url>
  <url>
    <loc>https://focconavida.com.br/sobre</loc>
    <lastmod>2025-12-16</lastmod>
    <changefreq>monthly</changefreq>
    <priority>0.8</priority>
  </url>
  <url>
    <loc>https://focconavida.com.br/metodo</loc>
    <lastmod>2025-12-16</lastmod>
    <changefreq>monthly</changefreq>
    <priority>0.9</priority>
  </url>
  <url>
    <loc>https://focconavida.com.br/servicos</loc>
    <lastmod>2025-12-16</lastmod>
    <changefreq>monthly</changefreq>
    <priority>0.8</priority>
  </url>
  <url>
    <loc>https://focconavida.com.br/contato</loc>
    <lastmod>2025-12-16</lastmod>
    <changefreq>monthly</changefreq>
    <priority>0.7</priority>
  </url>
  <url>
    <loc>https://focconavida.com.br/blog</loc>
    <lastmod>2025-12-16</lastmod>
    <changefreq>daily</changefreq>
    <priority>0.9</priority>
  </url>

  <!-- =====================================================
       ARTIGOS DO BLOG - ATUALIZADOS EM 16/12/2025
       Total: 49+ artigos
  ===================================================== -->

  <!-- DIA 38 (11/12/2025) - ÚLTIMOS ARTIGOS PUBLICADOS -->
  <url>
    <loc>https://focconavida.com.br/blog/meditacao-para-quem-nao-consegue-parar-de-pensar</loc>
    <lastmod>2025-12-11</lastmod>
    <changefreq>monthly</changefreq>
    <priority>0.8</priority>
  </url>
  <url>
    <loc>https://focconavida.com.br/blog/como-sair-da-zona-de-conforto-sem-se-perder</loc>
    <lastmod>2025-12-11</lastmod>
    <changefreq>monthly</changefreq>
    <priority>0.8</priority>
  </url>

  <!-- DIA 37 (10/12/2025) -->
  <url>
    <loc>https://focconavida.com.br/blog/como-definir-metas-que-vai-alcançar</loc>
    <lastmod>2025-12-10</lastmod>
    <changefreq>monthly</changefreq>
    <priority>0.8</priority>
  </url>
  <url>
    <loc>https://focconavida.com.br/blog/inteligencia-emocional-trabalho-guia-pratico</loc>
    <lastmod>2025-12-10</lastmod>
    <changefreq>monthly</changefreq>
    <priority>0.8</priority>
  </url>

  <!-- DIA 36 (09/12/2025) -->
  <url>
    <loc>https://focconavida.com.br/blog/autocompaixao-habilidade-essencial</loc>
    <lastmod>2025-12-09</lastmod>
    <changefreq>monthly</changefreq>
    <priority>0.8</priority>
  </url>
  <url>
    <loc>https://focconavida.com.br/blog/sindrome-burnout-12-sinais-alerta</loc>
    <lastmod>2025-12-09</lastmod>
    <changefreq>monthly</changefreq>
    <priority>0.8</priority>
  </url>

  <!-- DIA 35 (08/12/2025) -->
  <url>
    <loc>https://focconavida.com.br/blog/como-criar-rotina-matinal-transformadora</loc>
    <lastmod>2025-12-08</lastmod>
    <changefreq>monthly</changefreq>
    <priority>0.8</priority>
  </url>

  <!-- DIA 34 (07/12/2025) -->
  <url>
    <loc>https://focconavida.com.br/blog/desenvolvimento-pessoal-vs-terapia-diferencas</loc>
    <lastmod>2025-12-07</lastmod>
    <changefreq>monthly</changefreq>
    <priority>0.8</priority>
  </url>

  <!-- DIA 33 (06/12/2025) -->
  <url>
    <loc>https://focconavida.com.br/blog/10-sinais-precisa-coaching-profissional</loc>
    <lastmod>2025-12-06</lastmod>
    <changefreq>monthly</changefreq>
    <priority>0.8</priority>
  </url>
  <url>
    <loc>https://focconavida.com.br/blog/tecnicas-respiracao-exercicios-ansiedade</loc>
    <lastmod>2025-12-06</lastmod>
    <changefreq>monthly</changefreq>
    <priority>0.8</priority>
  </url>

  <!-- DIA 32 (05/12/2025) -->
  <url>
    <loc>https://focconavida.com.br/blog/como-escolher-coach-criterios-essenciais</loc>
    <lastmod>2025-12-05</lastmod>
    <changefreq>monthly</changefreq>
    <priority>0.8</priority>
  </url>
  <url>
    <loc>https://focconavida.com.br/blog/mindfulness-para-iniciantes-guia-pratico</loc>
    <lastmod>2025-12-05</lastmod>
    <changefreq>monthly</changefreq>
    <priority>0.8</priority>
  </url>

  <!-- DIA 31 (04/12/2025) -->
  <url>
    <loc>https://focconavida.com.br/blog/metodo-focco-guia-completo</loc>
    <lastmod>2025-12-04</lastmod>
    <changefreq>monthly</changefreq>
    <priority>0.9</priority>
  </url>

  <!-- DIA 30 (03/12/2025) -->
  <url>
    <loc>https://focconavida.com.br/blog/lidar-adversidades-vida-tranquila</loc>
    <lastmod>2025-12-03</lastmod>
    <changefreq>monthly</changefreq>
    <priority>0.8</priority>
  </url>
  <url>
    <loc>https://focconavida.com.br/blog/desenvolver-ato-amor-proprio</loc>
    <lastmod>2025-12-03</lastmod>
    <changefreq>monthly</changefreq>
    <priority>0.8</priority>
  </url>

  <!-- POSTS ANTERIORES (24/11/2025) -->
  <url>
    <loc>https://focconavida.com.br/blog/voce-vive-no-automatico</loc>
    <lastmod>2025-11-24</lastmod>
    <changefreq>monthly</changefreq>
    <priority>0.8</priority>
  </url>
  <url>
    <loc>https://focconavida.com.br/blog/sera-que-consigo-focar-no-que-preciso</loc>
    <lastmod>2025-11-24</lastmod>
    <changefreq>monthly</changefreq>
    <priority>0.8</priority>
  </url>
  <url>
    <loc>https://focconavida.com.br/blog/4-dicas-potencializar-desenvolvimento-profissional-saudavel</loc>
    <lastmod>2025-11-24</lastmod>
    <changefreq>monthly</changefreq>
    <priority>0.8</priority>
  </url>
  <url>
    <loc>https://focconavida.com.br/blog/desenvolver-habilidades-profissional-sucesso-sem-adoecer</loc>
    <lastmod>2025-11-24</lastmod>
    <changefreq>monthly</changefreq>
    <priority>0.7</priority>
  </url>
  <url>
    <loc>https://focconavida.com.br/blog/se-voce-reclama-continua-igual-nada-muda</loc>
    <lastmod>2025-11-24</lastmod>
    <changefreq>monthly</changefreq>
    <priority>0.7</priority>
  </url>
  <url>
    <loc>https://focconavida.com.br/blog/comunicacao-assertiva-carreira-sucesso</loc>
    <lastmod>2025-11-24</lastmod>
    <changefreq>monthly</changefreq>
    <priority>0.7</priority>
  </url>

  <!-- POSTS FASE 1 -->
  <url>
    <loc>https://focconavida.com.br/blog/transicao-de-carreira-com-qualidade</loc>
    <lastmod>2025-11-04</lastmod>
    <changefreq>monthly</changefreq>
    <priority>0.7</priority>
  </url>
  <url>
    <loc>https://focconavida.com.br/blog/como-diminuir-estresse</loc>
    <lastmod>2025-11-04</lastmod>
    <changefreq>monthly</changefreq>
    <priority>0.7</priority>
  </url>
  <url>
    <loc>https://focconavida.com.br/blog/como-metodo-focco-transformar-vida</loc>
    <lastmod>2025-10-23</lastmod>
    <changefreq>monthly</changefreq>
    <priority>0.7</priority>
  </url>
  <url>
    <loc>https://focconavida.com.br/blog/por-que-tanta-gente-ansiosa</loc>
    <lastmod>2025-11-04</lastmod>
    <changefreq>monthly</changefreq>
    <priority>0.7</priority>
  </url>
  <url>
    <loc>https://focconavida.com.br/blog/importancia-da-pausa-na-vida-diaria</loc>
    <lastmod>2025-11-04</lastmod>
    <changefreq>monthly</changefreq>
    <priority>0.7</priority>
  </url>
  <url>
    <loc>https://focconavida.com.br/blog/por-que-procrastino-tanto</loc>
    <lastmod>2025-11-04</lastmod>
    <changefreq>monthly</changefreq>
    <priority>0.7</priority>
  </url>
  <url>
    <loc>https://focconavida.com.br/blog/importancia-de-aprender-dizer-nao</loc>
    <lastmod>2025-11-04</lastmod>
    <changefreq>monthly</changefreq>
    <priority>0.7</priority>
  </url>
  <url>
    <loc>https://focconavida.com.br/blog/importancia-respiracao-consciente</loc>
    <lastmod>2025-11-04</lastmod>
    <changefreq>monthly</changefreq>
    <priority>0.7</priority>
  </url>
  <url>
    <loc>https://focconavida.com.br/blog/desenvolvendo-equilibrio-emocional</loc>
    <lastmod>2025-11-04</lastmod>
    <changefreq>monthly</changefreq>
    <priority>0.7</priority>
  </url>
  <url>
    <loc>https://focconavida.com.br/blog/importancia-autoconhecimento-jornada-profissional</loc>
    <lastmod>2025-10-23</lastmod>
    <changefreq>monthly</changefreq>
    <priority>0.7</priority>
  </url>
  <url>
    <loc>https://focconavida.com.br/blog/regular-emocoes-profissional-notado</loc>
    <lastmod>2025-11-04</lastmod>
    <changefreq>monthly</changefreq>
    <priority>0.7</priority>
  </url>
  <url>
    <loc>https://focconavida.com.br/blog/investir-mudar-estilo-vida-transforma-futuro</loc>
    <lastmod>2025-11-04</lastmod>
    <changefreq>monthly</changefreq>
    <priority>0.7</priority>
  </url>
  <url>
    <loc>https://focconavida.com.br/blog/construir-confianca-verdadeira</loc>
    <lastmod>2025-11-06</lastmod>
    <changefreq>monthly</changefreq>
    <priority>0.7</priority>
  </url>
  <url>
    <loc>https://focconavida.com.br/blog/5-sinais-precisa-coaching-pessoal</loc>
    <lastmod>2025-10-23</lastmod>
    <changefreq>monthly</changefreq>
    <priority>0.7</priority>
  </url>
  <url>
    <loc>https://focconavida.com.br/blog/ansiedade-nao-precisa-parar-voce</loc>
    <lastmod>2025-11-04</lastmod>
    <changefreq>monthly</changefreq>
    <priority>0.7</priority>
  </url>
  <url>
    <loc>https://focconavida.com.br/blog/perfeccionismo-adoece</loc>
    <lastmod>2025-11-04</lastmod>
    <changefreq>monthly</changefreq>
    <priority>0.7</priority>
  </url>
  <url>
    <loc>https://focconavida.com.br/blog/atencao-ao-seu-corpo</loc>
    <lastmod>2025-11-05</lastmod>
    <changefreq>monthly</changefreq>
    <priority>0.7</priority>
  </url>
  <url>
    <loc>https://focconavida.com.br/blog/falta-atencao-retrabalho</loc>
    <lastmod>2025-11-05</lastmod>
    <changefreq>monthly</changefreq>
    <priority>0.7</priority>
  </url>
  <url>
    <loc>https://focconavida.com.br/blog/nao-consegue-parar-pensar-trabalho</loc>
    <lastmod>2025-11-06</lastmod>
    <changefreq>monthly</changefreq>
    <priority>0.7</priority>
  </url>
  <url>
    <loc>https://focconavida.com.br/blog/culpa-paralisa-transformar-erro-aprendizado</loc>
    <lastmod>2025-11-07</lastmod>
    <changefreq>monthly</changefreq>
    <priority>0.7</priority>
  </url>
  <url>
    <loc>https://focconavida.com.br/blog/energia-mental-limite-esgotando-errado</loc>
    <lastmod>2025-11-07</lastmod>
    <changefreq>monthly</changefreq>
    <priority>0.7</priority>
  </url>

</urlset>
